{
  "schema_version": 1,
  "backend": "file-json-v1",
  "node_types": [
    "concept",
    "signal",
    "mechanism",
    "hypothesis",
    "experiment",
    "finding",
    "dataset",
    "regime",
    "indicator",
    "strategy",
    "rejection",
    "open-question"
  ],
  "relation_types": [
    "supports",
    "contradicts",
    "tests",
    "tested_by",
    "depends_on",
    "derived_from",
    "confounded_by",
    "explained_by",
    "alternative_to",
    "uses_signal",
    "observed_in",
    "valid_in_regime",
    "fails_in_regime",
    "implemented_by",
    "supersedes",
    "related_to"
  ],
  "nodes": [
    {
      "id": "CON-001",
      "type": "concept",
      "title": "Impulse exhaustion",
      "summary": "A real-time state in which directional progress becomes harder to sustain; it is not a hindsight-defined terminal pivot.",
      "status": "defined",
      "tags": ["impulse", "exhaustion", "real-time", "effort-response", "book-depth"],
      "path": "research/concepts/CON-001.md",
      "updated": "2026-09-13"
    },
    {
      "id": "SIG-001",
      "type": "signal",
      "title": "Price response efficiency",
      "summary": "Directional price progress per unit of contemporaneous aggressive flow, measured using only information available at time t.",
      "status": "draft-definition",
      "tags": ["price-response", "efficiency", "aggressive-flow", "volume-per-move", "price-velocity"],
      "path": "research/signals/SIG-001.md",
      "updated": "2026-09-13"
    },
    {
      "id": "SIG-002",
      "type": "signal",
      "title": "Aggressive trade flow",
      "summary": "Signed buyer- versus seller-initiated traded quantity over a declared event or clock-time window.",
      "status": "draft-definition",
      "tags": ["delta", "aggressor", "trade-flow"],
      "path": "research/signals/SIG-002.md",
      "updated": "2026-09-10"
    },
    {
      "id": "MEC-001",
      "type": "mechanism",
      "title": "Passive liquidity absorption",
      "summary": "Resting or replenishing liquidity absorbs aggressive orders so flow remains directional while price progress decays.",
      "status": "proposed",
      "tags": ["absorption", "passive-liquidity", "replenishment", "side-specific-depth", "order-book"],
      "path": "research/mechanisms/MEC-001.md",
      "updated": "2026-09-13"
    },
    {
      "id": "MEC-002",
      "type": "mechanism",
      "title": "Mechanical volatility normalization",
      "summary": "An apparent response collapse can arise from scale choice, volatility change, or denominator growth without participant-level absorption.",
      "status": "proposed-alternative",
      "tags": ["volatility", "normalization", "confounder"],
      "path": "research/mechanisms/MEC-002.md",
      "updated": "2026-09-10"
    },
    {
      "id": "MEC-003",
      "type": "mechanism",
      "title": "Price-insensitive forced-flow dislocation",
      "summary": "Constrained or externally motivated flow can overwhelm available liquidity and temporarily dislocate price, while competing traders pull impact forward and compress the opportunity.",
      "status": "proposed-source-derived",
      "tags": ["forced-flow", "price-insensitive", "liquidity", "dislocation", "adaptation", "crypto", "venue-leadership"],
      "path": "research/mechanisms/MEC-003.md",
      "updated": "2026-09-13"
    },
    {
      "id": "HYP-001",
      "type": "hypothesis",
      "title": "Diminishing response predicts failed continuation",
      "summary": "Conditional on an active directional impulse, falling price response to continued same-side aggressive flow predicts lower near-horizon continuation than matched baselines.",
      "status": "unvalidated-example",
      "tags": ["failed-continuation", "price-response", "absorption", "example"],
      "path": "research/hypotheses/HYP-001.md",
      "updated": "2026-09-10"
    },
    {
      "id": "EXP-001",
      "type": "experiment",
      "title": "Matched event-time response-decay test",
      "summary": "Illustrative leakage-safe design comparing continuation after response decay with volatility-, trend-, spread-, and impulse-matched controls.",
      "status": "design-only",
      "tags": ["event-time", "matched-control", "leakage", "example"],
      "path": "research/experiments/EXP-001.md",
      "updated": "2026-09-10"
    },
    {
      "id": "FND-001",
      "type": "finding",
      "title": "Illustrative supportive result placeholder",
      "summary": "Synthetic example of how a supportive finding would link to HYP-001; it contains no measured market result.",
      "status": "illustrative-not-evidence",
      "tags": ["support", "synthetic", "example"],
      "path": "research/findings/FND-001.md",
      "updated": "2026-09-10"
    },
    {
      "id": "FND-002",
      "type": "finding",
      "title": "Illustrative contradictory result placeholder",
      "summary": "Synthetic example of a regime-specific null or opposite result preserved alongside support; it contains no measured market result.",
      "status": "illustrative-not-evidence",
      "tags": ["contradiction", "synthetic", "example"],
      "path": "research/findings/FND-002.md",
      "updated": "2026-09-10"
    },
    {
      "id": "DAT-001",
      "type": "dataset",
      "title": "Illustrative BTC trade and quote event stream",
      "summary": "Placeholder data contract for synchronized trades and top-of-book quotes; no dataset is bundled and no quality claims are made.",
      "status": "specification-only",
      "tags": ["btc", "trades", "quotes", "example"],
      "path": "research/datasets/DAT-001.md",
      "updated": "2026-09-10"
    },
    {
      "id": "REG-001",
      "type": "regime",
      "title": "High-volatility liquid session",
      "summary": "Illustrative conditioning state defined by ex-ante rolling volatility, spread, and depth percentiles rather than future outcomes.",
      "status": "draft-definition",
      "tags": ["volatility", "liquidity", "regime", "example"],
      "path": "research/regimes/REG-001.md",
      "updated": "2026-09-10"
    },
    {
      "id": "REG-002",
      "type": "regime",
      "title": "Quiet liquid session",
      "summary": "Illustrative low-volatility conditioning state defined causally from lagged volatility while spread and depth remain liquid.",
      "status": "draft-definition",
      "tags": ["low-volatility", "liquidity", "regime", "example"],
      "path": "research/regimes/REG-002.md",
      "updated": "2026-09-10"
    },
    {
      "id": "IND-001",
      "type": "indicator",
      "title": "Flow-shock and response-decay monitor",
      "summary": "Unvalidated MMT prototype with the original live card and halos plus a compact two-sided, magnitude-graded Flow Shock ribbon; response decay remains design-only.",
      "status": "prototype-unvalidated",
      "tags": ["indicator", "real-time", "aggressive-flow", "response-decay", "mmt"],
      "path": "research/indicators/IND-001.md",
      "updated": "2026-09-13"
    },
    {
      "id": "IND-002",
      "type": "indicator",
      "title": "Delta Candle Pressure Divergence v3 port",
      "summary": "Corrected MMT v3 port with graded dark-chart palettes, a soft-knee pressure ribbon, prior-peak-expanded glow-line CVD, close-confirmed divergence, causal warm-up, and bounded entities.",
      "status": "platform-runtime-debugging-unverified",
      "tags": ["indicator", "delta", "divergence", "pressure", "cvd", "mmt-v3"],
      "path": "research/indicators/IND-002.md",
      "updated": "2026-09-13"
    },
    {
      "id": "IND-003",
      "type": "indicator",
      "title": "Flow Shock x Delta Pressure sequence",
      "summary": "Unvalidated MMT v3 prototype that permits one aligned Flow Shock arm per confirmed delta-pressure impulse, then upgrades the event through joint pressure decay and price reclaim states.",
      "status": "prototype-unvalidated",
      "tags": ["indicator", "flow-shock", "delta-pressure", "deduplication", "state-machine", "mmt-v3"],
      "path": "research/indicators/IND-003.md",
      "updated": "2026-09-11"
    },
    {
      "id": "IND-004",
      "type": "indicator",
      "title": "Comet speed and density lab",
      "summary": "Unvalidated MMT v3 research indicator with lab and compact graded-ribbon views that keep two-active-second speed, activity, and volume-per-move density inspectable.",
      "status": "syntax-informed-prototype-unverified",
      "tags": ["indicator", "price-velocity", "trade-intensity", "density", "response-fade", "mmt-v3"],
      "path": "research/indicators/IND-004.md",
      "updated": "2026-09-13"
    },
    {
      "id": "STR-001",
      "type": "strategy",
      "title": "Response-decay trade-avoidance rule",
      "summary": "Illustrative strategy concept that suppresses momentum entries during response decay; no edge or profitability is claimed.",
      "status": "blocked-pending-validation",
      "tags": ["avoidance", "execution", "response-decay", "example"],
      "path": "research/strategies/STR-001.md",
      "updated": "2026-09-10"
    },
    {
      "id": "REJ-001",
      "type": "rejection",
      "title": "Raw delta divergence as standalone reversal edge",
      "summary": "Example rejection record: raw divergence alone lacks a stable event definition, independent information test, and execution-aware evidence.",
      "status": "rejected-example",
      "tags": ["delta-divergence", "reversal", "rejection", "example"],
      "path": "research/rejections/REJ-001.md",
      "updated": "2026-09-10"
    },
    {
      "id": "REJ-002",
      "type": "rejection",
      "title": "Naive cross-venue perp funding capture as a standalone edge",
      "summary": "Source-reported failure in which noisy relative-funding forecasts, basis complexity, fees, execution, and balance fragmentation erased apparent perp-perp carry profits.",
      "status": "source-reported-rejection-unverified",